[
    {
        "title": "Alibaba Cloud AI Training Certificates",
        "issuer": "Alibaba Cloud",
        "date": "25 Nov 2025",
        "type": "Certification",
        "description": "Earned 10 AI training certificates from Alibaba Cloud across various artificial intelligence topics.",
        "url": "https://drive.google.com/drive/folders/13wzvw1uV0IgZI9FEm3RpyVg0NJ8rbLiv?usp=sharing"
    },
    {
        "title": "ASEAN Data Science Explorers 2024 Participant",
        "issuer": "SAP and ASEAN Foundation",
        "date": "25 Apr 2024",
        "type": "Participation",
        "description": "Received a participant certificate for joining the ASEAN Data Science Explorers 2024 program.",
        "url": "https://drive.google.com/file/d/1aVfp4OOI0X4smt1LWdHL1DmEfhEr7Zzq/view?usp=sharing"
    },
    {
        "title": "Microsoft Azure AI Fundamentals",
        "issuer": "Microsoft, Kartu Prakerja, and Mereka",
        "date": "1 Jul 2024",
        "type": "Certification",
        "description": "Completed the Microsoft Azure AI Fundamentals course and earned the official certificate.",
        "url": "https://drive.google.com/file/d/1-fshYVogwXalVjQxqRDooYkuif6BW2Y9/view?usp=sharing"
    },
    {
        "title": "4th Place, The 11th UTU Award Online Store Design Competition",
        "issuer": "Teuku Umar University",
        "date": "4 Sep 2025",
        "type": "Competition",
        "description": "Awarded 4th place in the online store design competition at The 11th UTU Award."
    }
]